{
  "$schema": "http://json-schema.org/draft-07/schema#",
  "$id": "worldhub://schemas/application-contract-1",
  "title": "World Hub Application Contract, version 1",
  "type": "object",
  "additionalProperties": false,
  "required": [
    "format",
    "contractFormatVersion",
    "appType",
    "name",
    "supportedProtocolVersions"
  ],
  "properties": {
    "format": {
      "const": "world-hub-application-contract"
    },
    "contractFormatVersion": {
      "const": 1,
      "description": "The format version of this document. This is what a consumer gates compatibility on."
    },
    "appType": {
      "type": "string",
      "pattern": "^[a-z0-9][a-z0-9.-]{1,80}$"
    },
    "name": {
      "type": "string",
      "minLength": 1,
      "maxLength": 200
    },
    "description": {
      "type": "string",
      "maxLength": 4000
    },
    "supportedProtocolVersions": {
      "type": "array",
      "minItems": 1,
      "items": {
        "type": "integer",
        "minimum": 1
      }
    },
    "productionFields": {
      "type": "array",
      "maxItems": 100,
      "items": {
        "$ref": "#/$defs/fieldDef"
      }
    },
    "entitySelections": {
      "type": "array",
      "maxItems": 20,
      "items": {
        "$ref": "#/$defs/entitySelection"
      }
    },
    "connectionSelections": {
      "type": "array",
      "maxItems": 20,
      "description": "Canonical connection kinds this application consumes, between records two of its entity selections already include. Optional: a contract without it is unchanged, and no connection reaches the application through it.",
      "items": {
        "$ref": "#/$defs/connectionSelection"
      }
    },
    "assetSets": {
      "type": "array",
      "maxItems": 20,
      "items": {
        "$ref": "#/$defs/assetSet"
      }
    },
    "documents": {
      "type": "object",
      "additionalProperties": false,
      "properties": {
        "mode": {
          "enum": [
            "none",
            "linked",
            "selected"
          ]
        }
      },
      "required": [
        "mode"
      ]
    },
    "requiredRecipes": {
      "type": "array",
      "maxItems": 20,
      "items": {
        "type": "string",
        "pattern": "^[a-z0-9_]{1,60}$"
      }
    }
  },
  "$defs": {
    "slug": {
      "type": "string",
      "pattern": "^[a-z0-9][a-z0-9_-]{0,60}$"
    },
    "fieldDef": {
      "type": "object",
      "additionalProperties": false,
      "required": [
        "id",
        "label",
        "type"
      ],
      "properties": {
        "id": {
          "$ref": "#/$defs/slug"
        },
        "label": {
          "type": "string",
          "minLength": 1,
          "maxLength": 200
        },
        "type": {
          "enum": [
            "shortText",
            "multilineText",
            "markdown",
            "integer",
            "number",
            "boolean",
            "enum",
            "color",
            "entityRef",
            "assetRef",
            "list"
          ]
        },
        "required": {
          "type": "boolean"
        },
        "hint": {
          "type": "string",
          "maxLength": 500
        },
        "section": {
          "type": "string",
          "maxLength": 80,
          "description": "Groups this field with its neighbours under a named, collapsible heading in the production editor. Consecutive fields sharing a section are shown together."
        },
        "advanced": {
          "type": "boolean",
          "description": "Fields an author rarely touches. Their section starts collapsed, so the screen opens on the things people actually came to write."
        },
        "default": {},
        "minLength": {
          "type": "integer",
          "minimum": 0
        },
        "maxLength": {
          "type": "integer",
          "minimum": 1
        },
        "pattern": {
          "type": "string",
          "maxLength": 300
        },
        "min": {
          "type": "number"
        },
        "max": {
          "type": "number"
        },
        "step": {
          "type": "number",
          "exclusiveMinimum": 0
        },
        "options": {
          "type": "array",
          "minItems": 1,
          "maxItems": 100,
          "items": {
            "type": "object",
            "additionalProperties": false,
            "required": [
              "value",
              "label"
            ],
            "properties": {
              "value": {
                "type": "string",
                "maxLength": 100
              },
              "label": {
                "type": "string",
                "maxLength": 200
              }
            }
          }
        },
        "entityTypes": {
          "type": "array",
          "minItems": 1,
          "items": {
            "enum": [
              "world",
              "character",
              "location",
              "group",
              "species",
              "object",
              "event",
              "lore"
            ]
          }
        },
        "assetKinds": {
          "type": "array",
          "minItems": 1,
          "items": {
            "enum": [
              "image",
              "audio",
              "markdown",
              "attachment"
            ]
          }
        },
        "assetRoles": {
          "type": "array",
          "items": {
            "type": "string",
            "maxLength": 100
          }
        },
        "recipes": {
          "type": "array",
          "maxItems": 10,
          "items": {
            "type": "string",
            "pattern": "^[a-z0-9_]{1,60}$"
          }
        },
        "item": {
          "$ref": "#/$defs/fieldDef"
        },
        "fields": {
          "type": "array",
          "minItems": 1,
          "maxItems": 30,
          "items": {
            "$ref": "#/$defs/fieldDef"
          }
        },
        "minItems": {
          "type": "integer",
          "minimum": 0
        },
        "maxItems": {
          "type": "integer",
          "minimum": 1
        }
      },
      "allOf": [
        {
          "if": {
            "properties": {
              "type": {
                "const": "enum"
              }
            }
          },
          "then": {
            "required": [
              "options"
            ]
          }
        },
        {
          "if": {
            "properties": {
              "type": {
                "const": "entityRef"
              }
            }
          },
          "then": {
            "required": [
              "entityTypes"
            ]
          }
        },
        {
          "if": {
            "properties": {
              "type": {
                "const": "list"
              }
            }
          },
          "then": {
            "anyOf": [
              {
                "required": [
                  "item"
                ]
              },
              {
                "required": [
                  "fields"
                ]
              }
            ]
          }
        }
      ]
    },
    "entitySelection": {
      "type": "object",
      "additionalProperties": false,
      "required": [
        "id",
        "label",
        "entityTypes"
      ],
      "properties": {
        "id": {
          "$ref": "#/$defs/slug"
        },
        "label": {
          "type": "string",
          "minLength": 1,
          "maxLength": 200
        },
        "entityTypes": {
          "type": "array",
          "minItems": 1,
          "items": {
            "enum": [
              "world",
              "character",
              "location",
              "group",
              "species",
              "object",
              "event",
              "lore"
            ]
          }
        },
        "min": {
          "type": "integer",
          "minimum": 0
        },
        "max": {
          "type": "integer",
          "minimum": 1
        },
        "exact": {
          "type": "integer",
          "minimum": 1
        },
        "ordered": {
          "type": "boolean"
        },
        "hint": {
          "type": "string",
          "maxLength": 500
        },
        "fields": {
          "type": "array",
          "maxItems": 50,
          "items": {
            "$ref": "#/$defs/fieldDef"
          }
        },
        "assetSets": {
          "type": "array",
          "maxItems": 10,
          "items": {
            "$ref": "#/$defs/assetSet"
          }
        }
      }
    },
    "connectionSelection": {
      "type": "object",
      "additionalProperties": false,
      "required": [
        "id",
        "label",
        "kinds",
        "sourceSelection",
        "targetSelection"
      ],
      "properties": {
        "id": {
          "$ref": "#/$defs/slug"
        },
        "label": {
          "type": "string",
          "minLength": 1,
          "maxLength": 200
        },
        "kinds": {
          "type": "array",
          "minItems": 1,
          "maxItems": 20,
          "description": "Connection kind ids, as published in catalog/connection-kinds.json.",
          "items": {
            "type": "string",
            "pattern": "^[a-z0-9][a-z0-9_]{0,79}$"
          }
        },
        "sourceSelection": {
          "$ref": "#/$defs/slug",
          "description": "The entity selection the connections run from."
        },
        "targetSelection": {
          "$ref": "#/$defs/slug",
          "description": "The entity selection they run to. A connection whose target is not selected is a warning the author can act on, never a silent traversal into the package."
        },
        "minPerSource": {
          "type": "integer",
          "minimum": 0
        },
        "maxPerSource": {
          "type": "integer",
          "minimum": 1,
          "description": "An application restriction, not a canonical one: World Hub may allow a character in several groups while a game allows one faction."
        },
        "hint": {
          "type": "string",
          "maxLength": 500
        }
      }
    },
    "assetSet": {
      "type": "object",
      "additionalProperties": false,
      "required": [
        "id",
        "label"
      ],
      "properties": {
        "id": {
          "$ref": "#/$defs/slug"
        },
        "label": {
          "type": "string",
          "minLength": 1,
          "maxLength": 200
        },
        "kinds": {
          "type": "array",
          "minItems": 1,
          "items": {
            "enum": [
              "image",
              "audio",
              "markdown",
              "attachment"
            ]
          }
        },
        "roles": {
          "type": "array",
          "items": {
            "type": "string",
            "maxLength": 100
          }
        },
        "recipes": {
          "type": "array",
          "items": {
            "type": "string",
            "pattern": "^[a-z0-9_]{1,60}$"
          }
        },
        "min": {
          "type": "integer",
          "minimum": 0
        },
        "max": {
          "type": "integer",
          "minimum": 1
        },
        "exact": {
          "type": "integer",
          "minimum": 1
        },
        "hint": {
          "type": "string",
          "maxLength": 500
        },
        "itemFields": {
          "type": "array",
          "maxItems": 20,
          "items": {
            "$ref": "#/$defs/fieldDef"
          }
        }
      }
    }
  }
}
