{
  "format": "world-hub-application-contract",
  "contractFormatVersion": 1,
  "appType": "task-stamps.stamp-set",
  "name": "Task Stamps — Stamp Set",
  "description": "Worlds and characters for the Task Stamps habit tracker. Each character brings a portrait, optional Boss artwork and defeat sound, an optional signature sound, and exactly fifteen ordered stamp images earned by completing tasks. Characters should belong to the selected worlds.",
  "supportedProtocolVersions": [
    1,
    2
  ],
  "productionFields": [],
  "entitySelections": [
    {
      "id": "stamp_worlds",
      "label": "Worlds",
      "entityTypes": [
        "world"
      ],
      "min": 1,
      "ordered": true,
      "hint": "The worlds the stamp characters come from. Each needs a cover for the world picker.",
      "fields": [],
      "assetSets": [
        {
          "id": "world_cover",
          "label": "World cover",
          "kinds": [
            "image"
          ],
          "roles": [
            "world.cover"
          ],
          "recipes": [
            "tile_16x9",
            "thumbnail_square"
          ],
          "exact": 1,
          "hint": "Shown in the world library and pickers."
        }
      ]
    },
    {
      "id": "stamp_characters",
      "label": "Characters",
      "entityTypes": [
        "character"
      ],
      "min": 1,
      "ordered": true,
      "hint": "Characters that hand out stamps. A character is only usable once all fifteen stamps are present.",
      "fields": [],
      "assetSets": [
        {
          "id": "portrait",
          "label": "Portrait",
          "kinds": [
            "image"
          ],
          "roles": [
            "character.portrait"
          ],
          "recipes": [
            "portrait_3x4",
            "thumbnail_square"
          ],
          "exact": 1,
          "hint": "Shown in the character library and on assignment cards."
        },
        {
          "id": "boss_image",
          "label": "Boss image",
          "kinds": [
            "image"
          ],
          "roles": [
            "character.tile"
          ],
          "recipes": [
            "original",
            "tile_16x9",
            "thumbnail_square"
          ],
          "min": 0,
          "max": 1,
          "hint": "Optional. Shown in the rotating daily Boss banner; images of any dimensions are accepted and fitted into the widescreen banner."
        },
        {
          "id": "boss_sound",
          "label": "Boss defeat sound",
          "kinds": [
            "audio"
          ],
          "roles": [
            "audio.cue"
          ],
          "recipes": [
            "original"
          ],
          "min": 0,
          "max": 1,
          "hint": "Optional. Played after the normal stamp sounds when this character's daily Boss is defeated."
        },
        {
          "id": "stamps",
          "label": "Stamps — fifteen, in order",
          "kinds": [
            "image"
          ],
          "roles": [
            "character.stamp"
          ],
          "recipes": [
            "stamp_4x3"
          ],
          "exact": 15,
          "hint": "The fifteen stamp images in earning order: slot 1 is the first stamp a task completion can award."
        },
        {
          "id": "default_sound",
          "label": "Signature sound",
          "kinds": [
            "audio"
          ],
          "roles": [
            "audio.cue"
          ],
          "min": 0,
          "max": 1,
          "hint": "Optional. Played when a stamp without its own sound is placed."
        },
        {
          "id": "stamp_sounds",
          "label": "Per-stamp sounds",
          "kinds": [
            "audio"
          ],
          "roles": [
            "audio.voice_line"
          ],
          "min": 0,
          "max": 15,
          "hint": "Optional sounds for individual stamps. Set each sound's stamp number.",
          "itemFields": [
            {
              "id": "stamp_number",
              "label": "Stamp number",
              "type": "integer",
              "required": true,
              "min": 1,
              "max": 15,
              "hint": "Which stamp (1–15) this sound belongs to."
            }
          ]
        }
      ]
    }
  ],
  "assetSets": [],
  "documents": {
    "mode": "none"
  },
  "requiredRecipes": [
    "portrait_3x4",
    "stamp_4x3",
    "thumbnail_square",
    "tile_16x9"
  ]
}
